{
  "$schema": "https://anthropic.com/claude-code/marketplace.schema.json",
  "name": "yellow-plugins",
  "description": "Personal curated collection of Claude Code plugins for development productivity and code quality",
  "owner": {
    "name": "KingInYellows",
    "url": "https://github.com/KingInYellows"
  },
  "metadata": {
    "description": "Git-native, schema-validated plugin marketplace for Claude Code",
    "version": "1.1.0"
  },
  "plugins": [
    {
      "name": "gt-workflow",
      "description": "Graphite-native workflow commands for stacked PRs, smart commits, sync, and stack navigation",
      "version": "2.0.9",
      "author": {
        "name": "KingInYellows"
      },
      "source": "./plugins/gt-workflow",
      "category": "development"
    },
    {
      "name": "github-workflow",
      "description": "GitHub-native stacked-PR provider — full command surface (setup, status, plan, submit, amend, sync, nav, cleanup, merge)",
      "version": "0.3.7",
      "author": {
        "name": "KingInYellows"
      },
      "source": "./plugins/github-workflow",
      "category": "development"
    },
    {
      "name": "yellow-core",
      "description": "Dev toolkit with review agents, research agents, and workflow commands for TypeScript, Python, Rust, and Go",
      "version": "2.11.8",
      "author": {
        "name": "KingInYellows"
      },
      "source": "./plugins/yellow-core",
      "category": "development"
    },
    {
      "name": "yellow-linear",
      "description": "Linear MCP integration with PM workflows for issues, projects, initiatives, cycles, and documents",
      "version": "2.2.2",
      "author": {
        "name": "KingInYellows"
      },
      "source": "./plugins/yellow-linear",
      "category": "productivity"
    },
    {
      "name": "yellow-cursor",
      "description": "Cursor Cloud Agents integration — delegate coding tasks to Cursor's remote agents, track status, and manage runs",
      "version": "0.3.0",
      "author": {
        "name": "KingInYellows"
      },
      "source": "./plugins/yellow-cursor",
      "category": "development"
    },
    {
      "name": "yellow-devin",
      "description": "Devin.AI V3 API integration — delegate tasks, manage sessions, review and remediate PRs, orchestrate plan-implement-review chains",
      "version": "3.0.10",
      "author": {
        "name": "KingInYellows"
      },
      "source": "./plugins/yellow-devin",
      "category": "development"
    },
    {
      "name": "yellow-jules",
      "description": "Google Jules integration (deprecated: Jules is read-only from 2026-11-11 and shuts down 2026-12-31) — delegate, supervise, and review Jules remote-agent sessions under owner-written grants",
      "version": "0.4.2",
      "author": {
        "name": "KingInYellows"
      },
      "source": "./plugins/yellow-jules",
      "category": "development"
    },
    {
      "name": "yellow-review",
      "description": "Multi-agent PR review with adaptive agent selection, parallel comment resolution, and sequential stack review",
      "version": "3.14.0",
      "author": {
        "name": "KingInYellows"
      },
      "source": "./plugins/yellow-review",
      "category": "development"
    },
    {
      "name": "yellow-ruvector",
      "description": "Persistent vector memory and semantic code search for Claude Code agents via ruvector",
      "version": "2.0.5",
      "author": {
        "name": "KingInYellows"
      },
      "source": "./plugins/yellow-ruvector",
      "category": "development"
    },
    {
      "name": "yellow-browser-test",
      "description": "Autonomous web app testing with agent-browser — auto-discovery, structured flows, and bug reporting",
      "version": "1.1.12",
      "author": {
        "name": "KingInYellows"
      },
      "source": "./plugins/yellow-browser-test",
      "category": "testing"
    },
    {
      "name": "yellow-debt",
      "description": "Technical debt audit and remediation with parallel scanner agents for AI-generated code patterns",
      "version": "1.9.6",
      "author": {
        "name": "KingInYellows"
      },
      "source": "./plugins/yellow-debt",
      "category": "development"
    },
    {
      "name": "yellow-ci",
      "description": "CI failure diagnosis, workflow linting, and runner health management for self-hosted GitHub Actions runners",
      "version": "1.5.10",
      "author": {
        "name": "KingInYellows"
      },
      "source": "./plugins/yellow-ci",
      "category": "development"
    },
    {
      "name": "yellow-composio",
      "description": "Optional Composio accelerator for batch workflows with usage tracking",
      "version": "3.0.3",
      "author": {
        "name": "KingInYellows"
      },
      "source": "./plugins/yellow-composio",
      "category": "productivity"
    },
    {
      "name": "yellow-research",
      "description": "Deep research plugin with Ceramic, DeepWiki, Perplexity, Tavily, EXA, and Parallel Task MCP servers, plus optional ast-grep CLI code search. Code research inline; deep research saved to docs/research/.",
      "version": "5.2.1",
      "author": {
        "name": "KingInYellows"
      },
      "source": "./plugins/yellow-research",
      "category": "productivity"
    },
    {
      "name": "yellow-morph",
      "description": "Intelligent code editing and search via Morph Fast Apply and WarpGrep",
      "version": "1.3.3",
      "author": {
        "name": "KingInYellows"
      },
      "source": "./plugins/yellow-morph",
      "category": "development"
    },
    {
      "name": "yellow-semgrep",
      "description": "Semgrep security finding remediation — fetch, fix, and verify 'to fix' findings from the Semgrep AppSec Platform",
      "version": "4.2.9",
      "author": {
        "name": "KingInYellows"
      },
      "source": "./plugins/yellow-semgrep",
      "category": "development"
    },
    {
      "name": "yellow-docs",
      "description": "Documentation audit, generation, and Mermaid diagram creation for any repository",
      "version": "1.4.1",
      "author": {
        "name": "KingInYellows"
      },
      "source": "./plugins/yellow-docs",
      "category": "development"
    },
    {
      "name": "yellow-codex",
      "description": "OpenAI Codex CLI wrapper with review, rescue, and analysis agents for workflow integration",
      "version": "0.5.1",
      "author": {
        "name": "KingInYellows"
      },
      "source": "./plugins/yellow-codex",
      "category": "development"
    },
    {
      "name": "yellow-council",
      "description": "On-demand cross-lineage code review fanning out to an in-process Claude reviewer plus the Codex, Gemini, and OpenCode CLIs in parallel for advisory consensus",
      "version": "0.6.4",
      "author": {
        "name": "KingInYellows"
      },
      "source": "./plugins/yellow-council",
      "category": "development"
    },
    {
      "name": "yellow-goal",
      "description": "yellow-goal engine bridge — probe a pinned goal-gen process, create/validate request packets, run zero-spend stub scenarios, and forward a user-only approval-gated real run. Never imports the engine.",
      "version": "0.4.0",
      "author": {
        "name": "KingInYellows"
      },
      "source": "./plugins/yellow-goal",
      "category": "development"
    },
    {
      "name": "yellow-claudemod",
      "description": "Claude Code mod that records the model each subagent runs on and can downshift listed Opus reviewers near a usage limit",
      "version": "0.1.2",
      "author": {
        "name": "KingInYellows"
      },
      "source": "./plugins/yellow-claudemod",
      "category": "development"
    }
  ]
}
